{
  "schemaVersion": "locale-architecture-adapters-v1",
  "locale": "ko",
  "statusLabels": {
    "released": "출시됨",
    "alpha": "알파",
    "unpublished": "미출시"
  },
  "head": {
    "eyebrow": "05 · 어댑터",
    "title": "시크릿을 판단하는 건 코어입니다. 텍스트는 누군가 가져다줘야 합니다.",
    "lede": [
      "텍스트를 가져와 코어에 넘기고 결과를 돌려주는 패키지 여섯 개입니다. ",
      {
        "b": "판단은 하지 않습니다."
      }
    ]
  },
  "theProblemItSolves": {
    "eyebrow": "해결하는 문제",
    "title": "복사한 예제는 이제 직접 관리해야 하는 포크입니다",
    "intro": null,
    "cards": [
      {
        "chip": "이전",
        "body": [
          "예제 폴더에서 ",
          {
            "code": "pino-redact.mjs"
          },
          "를 복사합니다. 지금은 잘 동작합니다. 하지만 pino 다음 메이저 버전에서 훅 시그니처가 바뀌어도 ",
          {
            "b": "알려 주는 사람이 없습니다."
          }
        ]
      },
      {
        "chip": "지금",
        "body": [
          {
            "code": [
              "npm install ",
              {
                "var": "adapterPinoName"
              }
            ]
          },
          ". 지원하는 pino 버전 범위가 명시되어 있고 ",
          {
            "b": "범위의 양 끝 버전에서 테스트"
          },
          "하며, tarball 안에 자체 changelog가 들어 있습니다."
        ]
      }
    ],
    "outro": [
      "복사한 파일에는 버전도 changelog도 없고, 호스트 SDK 계약이 바뀌어도 알려 주는 곳이 없습니다. 이 저장소는 ",
      {
        "b": "연결 코드를 코어로 옮기지 않고"
      },
      " 이 문제를 해결하려고 만들었습니다."
    ]
  },
  "whereTheySit": {
    "eyebrow": "위치",
    "title": "호스트와 엔진 사이",
    "nodeTitle1": "호스트",
    "node1": "pino 로거, OpenTelemetry span, Python 로그 레코드, MCP 도구 결과, 모델 프롬프트.",
    "arrow1": "어댑터가 텍스트를 넘기고",
    "claimSub": "무엇이 시크릿인지는 코어가 판단합니다. 어댑터는 판단하지 않습니다.",
    "claim": "Redact Secret 코어",
    "arrow2": "결과를 다시 받아 옵니다",
    "nodeTitle2": "시크릿이 빠진 같은 호스트",
    "node2": "로그 줄, span 속성, 도구 결과가 시크릿 없이 목적지로 갑니다."
  },
  "thePackages": {
    "eyebrow": "패키지",
    "title": "레지스트리 두 곳, 패키지 여섯 개",
    "tiles": [
      [
        "다른 패키지가 모두 기반으로 삼는 공용 패키지입니다. 문자열 하나를 가리는 기본 함수와, 중첩 객체 안에서 문자열을 찾는 ",
        {
          "b": "한도가 있는 탐색기(walker)"
        },
        "가 들어 있습니다. 연동을 직접 만들 때만 따로 설치하면 됩니다."
      ],
      [
        {
          "b": "값 기준"
        },
        "으로 가리며, pino 자체의 경로 기반 ",
        {
          "code": "redact"
        },
        "와 함께 씁니다. pino는 메시지 문자열이나 오류 메시지 속 토큰을 보지 못하지만, 이 패키지는 찾아냅니다."
      ],
      [
        "span과 이벤트의 문자열·문자열 배열 속성을 모두, span이 다음 processor로 넘어가기 전에 가립니다. 속성 이름을 허용 목록으로 제한하지 않으므로 OpenInference와 GenAI 규약도 ",
        {
          "b": "따로 하드코딩하지 않고"
        },
        " 처리합니다."
      ],
      [
        "특정 프레임워크에 묶이지 않는 AI 작업용 경계입니다. 사용자 입력, 도구 결과, 조립한 컨텍스트, 스트리밍 텍스트를 모델에 닿기 전에 정리합니다. ",
        {
          "b": "특정 모델 벤더, 에이전트 프레임워크, 전송 방식을 전제하지 않습니다."
        }
      ],
      [
        "Model Context Protocol 경계입니다. 도구 결과와 (선택적으로) 인자, 클라이언트가 ",
        {
          "code": "resources/read"
        },
        "로 읽는 내용을 검사합니다. 위 패키지를 얇게 특화해 MCP 형식만 더했습니다. ",
        {
          "b": "타입 정의용으로도 MCP SDK를 import하지 않습니다."
        }
      ],
      [
        "Python 표준 라이브러리에는 값 기반 가림 처리가 전혀 없습니다. 이 필터가 그 기능을 더하고, ",
        {
          "code": "[otel]"
        },
        " extra를 설치하면 span도 처리합니다."
      ]
    ],
    "pythonMeta": "logging 필터",
    "note": [
      "Langfuse처럼 마스킹 콜백을 쓰는 호스트는 ",
      {
        "b": "전용 패키지가 필요 없습니다"
      },
      ". 공용 탐색기만으로 연동이 끝납니다."
    ],
    "observed": [
      "버전과 호스트 범위는 ",
      {
        "var": "observedAt"
      },
      " 기준 npm·PyPI 레지스트리 값입니다."
    ]
  },
  "theDesignRule": {
    "eyebrow": "설계 원칙",
    "title": "애매하면 마커를 출력합니다",
    "lede": [
      "모든 어댑터는 문자열을 가리는 기본 함수 하나를 공유하며, 이 함수는 ",
      {
        "b": "오류가 나도 원문을 절대 내보내지 않습니다."
      },
      " 아래 마커는 공개 API입니다. 호스트가 실제로 보는 값이므로 메이저 버전에서만 바뀝니다."
    ],
    "markersLabel": "어댑터 마커",
    "head": [
      "마커",
      "출력 조건"
    ],
    "markers": [
      [
        {
          "code": "block"
        },
        " 판정. 매치된 범위만이 아니라 ",
        {
          "b": "값(leaf) 전체"
        },
        "를 바꿉니다."
      ],
      "코어 호출 중 생긴 모든 실패. 코어가 초기화되지 않은 경우도 포함합니다. 원본 텍스트도, 오류 메시지 자체도 내보내지 않습니다.",
      [
        "탐색 한도를 넘은 값. ",
        {
          "b": "검사하지 않으며, 가리지 않은 채 내보내지도 않습니다."
        }
      ],
      "자기 자신을 참조하는 객체."
    ],
    "warning": [
      {
        "b": "세 번째 줄에 주의하세요."
      },
      " 너무 커서 검사할 수 없는 값을 그냥 통과시키면 시크릿이 바로 그 틈으로 새어 나갑니다. ",
      {
        "b": "여기서는 검사할 수 없는 값은 출력하지도 않습니다."
      }
    ],
    "budgetsHeading": "탐색 한도",
    "budgets": [
      "최대 깊이",
      "최대 배열 길이",
      "최대 객체 키 수",
      "최대 전체 leaf 수"
    ],
    "budgetsNote": [
      "문자열 하나당 ",
      {
        "var": "stringChars"
      },
      "자 상한도 있습니다. 한도를 넘은 요소와 키는 ",
      {
        "b": "통과시키지 않고 버립니다."
      },
      " 모든 한도는 호출마다 바꿀 수 있습니다."
    ]
  },
  "whyItStaysSmall": {
    "eyebrow": "작게 유지하는 이유",
    "title": "코어에서 가져오는 것은 네 가지뿐",
    "rows": [
      "엔진을 불러옵니다.",
      "엔진이 돌려주는 결과의 형태.",
      "결과가 배열이라는 점.",
      [
        {
          "code": "block"
        },
        "인지 ",
        {
          "code": "warn"
        },
        "인지."
      ]
    ],
    "p": [
      "선언한 호환 범위가 보호하는 것이 바로 이 네 가지입니다. 이 패키지들은 코어가 export하는 타입을 기준으로 TypeScript로 작성했기 때문에, 이 부분이 바뀌면 ",
      {
        "b": "동작이 조용히 틀어지는 대신 빌드가 실패합니다."
      }
    ],
    "note": [
      {
        "b": "덕분에 릴리스도 독립적입니다."
      },
      " 코어는 Rust·npm·PyPI·CLI가 같은 버전으로 함께 릴리스되지만, 이 패키지들은 여기에 묶이지 않습니다. ",
      {
        "b": [
          "pino 새 버전이 나오면 ",
          {
            "code": "adapter-pino"
          },
          "만 새로 릴리스하고 나머지는 그대로입니다."
        ]
      }
    ]
  },
  "whatSupportedMeansHere": {
    "eyebrow": "여기서 말하는 “지원”",
    "title": "추측이 아니라 확인할 수 있는 범위",
    "lede": [
      "출시된 어댑터는 모두 지원하는 호스트 버전 범위를 명시하고, CI에서 ",
      {
        "b": "그 범위 양 끝 버전의 실제 호스트"
      },
      "로 테스트합니다."
    ],
    "rangesLabel": "어댑터별 호스트 지원 범위",
    "head": [
      "어댑터",
      "지원 범위",
      "검증 방법"
    ],
    "verifiedBy": [
      "캡처한 스트림에 기록하는 실제 pino 로거",
      [
        {
          "code": "onEnd"
        },
        "를 거치는 실제 span"
      ],
      "필터를 붙인 실제 로거",
      "실제 tracer provider를 거치는 실제 span"
    ],
    "p": [
      "선언한 범위 밖의 pino 메이저 버전은 ",
      {
        "b": "일부러"
      },
      " 지원한다고 적지 않습니다. 동작할 수도 있지만 테스트하지 않았기 때문입니다. 코어도 탐지기에 ",
      {
        "b": "같은 원칙"
      },
      "을 적용합니다."
    ]
  },
  "beingHonest": {
    "eyebrow": "솔직하게",
    "title": "여기에 없는 것",
    "noteTitle": "의도적으로 뺀 것",
    "items": [
      [
        {
          "b": "탐지."
        },
        " 무엇이 시크릿인지는 언제나 코어가 판단합니다."
      ],
      [
        {
          "b": "스트림 어댑터."
        },
        " Node ",
        {
          "code": "Transform"
        },
        "과 Web ",
        {
          "code": "TransformStream"
        },
        "은 코어에 ",
        {
          "code": "./node-stream"
        },
        "·",
        {
          "code": "./web-stream"
        },
        "으로 들어 있습니다."
      ],
      [
        {
          "b": "LangChain 패키지와 Langfuse 패키지."
        },
        " 마스킹 콜백을 쓰는 호스트는 패키지가 필요 없습니다. 공용 탐색기로 충분합니다."
      ],
      [
        {
          "b": "복원."
        },
        " 어댑터는 밖으로 나가는 출력만 정리합니다. 값을 되돌리는 기능은 ",
        {
          "b": "앞으로도 넣지 않습니다"
        },
        ". 복원은 ",
        {
          "a": "별도 저장소",
          "to": "architecture/vault"
        },
        "가 맡고, 이 패키지들은 그 저장소에 의존하지 않습니다."
      ]
    ]
  },
  "sources": {
    "label": "출처.",
    "body": [
      {
        "code": [
          {
            "var": "adaptersRepo"
          }
        ]
      },
      {
        "var": "atCommit"
      },
      "의 ",
      {
        "code": "README.md"
      },
      "·",
      {
        "code": "ARCHITECTURE.md"
      },
      ", 각 패키지의 README와 changelog. 버전은 저장소가 아니라 ",
      {
        "var": "observedAt"
      },
      " 기준 npm·PyPI 레지스트리에서 확인했습니다."
    ],
    "atCommit": [
      " ",
      {
        "code": [
          {
            "var": "commit"
          }
        ]
      }
    ]
  }
}
